{
  "schema_version": "datapan.health-registry-api-metadata-source-pin.v1",
  "registry_revision": "d7dba637a06e345cba7ae058cba96fe53d3e532b",
  "source": {
    "path": "data/data-go-kr.registry.json",
    "sha256": "0520d0db0d9ee07b7cbccce0c08439d0b02be901bf10e8491187d96e59d7a0d0",
    "size_bytes": 139155499
  },
  "catalog": {
    "path": "config/registry/health-probe-catalog.json",
    "sha256": "0503ddd9c93c31781c7920ccccdaf55aa5f3ed7e8061cb7dd16f0d8eb95611d2",
    "entry_count": 10
  },
  "expected_counts": {
    "api_entities": 12282,
    "api_operations": 12662,
    "link_operations": 8871,
    "operationless_catalog_entries": 473,
    "filedata_catalog_entries": 0,
    "institutions": 416,
    "matched_health_canaries": 10
  },
  "artifact": {
    "path": "config/registry/api-metadata.v1.json",
    "sha256": "e7481a131aefdfebf02483297fce50a72f8c50402da3beec31d0056ca71c9589"
  }
}
